<?xml version="1.0" encoding="UTF-8"?>
<!-- edited with XML Spy v4.3 U (http://www.xmlspy.com) by alakim (IVC) -->
<!DOCTYPE article SYSTEM "xdefs/manual.dtd">
<?xml-stylesheet type="text/xsl" href="xdefs/manual.xslt"?>
<article>
	<section title="Модуль jsDoc">
		<section title="Общее описание">
			<p>Предназначен для создания страниц документации скриптовых модулей.</p>
			<p>Документация оформляется в виде вызова конструктора <code>new Documentation</code>. Аргументами конструктора являются: имя документируемого объекта, его описание, и структура данных, описывающае его атрибуты и методы.</p>
			<p>Отображение документации производится вызовом статического метода <code>Documentation.show()</code>, добавляющего сформированную документацию в конец существующей веб-страницы.</p>
		</section>
		<section title="Формат данных для описания атрибутов и методов объекта">
			<p>Структура данных представляет собой массив, содержащий описания атрибутов и методов. Каждое такое описание представяет собой структуру, содержащую следующие атрибуты:</p>
			<list>
				<li name="type">тип элемента: <code>attribute</code>, <code>method</code>, <code>object</code>, <code>class</code>, <code>property</code>, и т.п.</li>
				<li name="name">имя элемента</li>
				<li name="dsc">описание элемента</li>
				<li name="children">(для элементов типа <code>object</code>) - массив, содержащий описания атрибутов и методов данного объекта</li>
			</list>
			<notice>Если описанный атрибут или метод отсутствует в объекте, его описание обозначается серым цветом шрифта.</notice>
			<p>Если документируемый объект является <sel>конструктором класса</sel>, то для описания <sel>нестатических членов</sel> данного класса следует создать атрибут типа <code>object</code> с именем <code>prototype</code>, и в коллекции <code>children</code> этого атрибута описать нестатические члены класса. При этом тип объекта для данного конструктора обозначается <code>class</code>.</p>
			<p>Если <sel>нестатические члены</sel> класса формируются <sel>не в прототипе</sel>, а в конструкторе, или добавляются в процессе выполнения кода, то для их описания добавляется атрибут типа <code>instance</code>, и в коллекции <code>children</code> этого атрибута добавляются описания данных членов класса.</p>
		</section>
	</section>
</article>
